Recommendation;Priority;Estimated Impact;Complexity
Implement a real-time alert system based on our model with a threshold of 99.0%;High;High;Medium
Strengthen monitoring of transactions made during high-risk hours;High;Medium;Low
Set up additional verification for transactions in small amount categories (0-10$);Medium;Medium;Low
Create a monitoring dashboard similar to our prototype for fraud analysts;Medium;Low;Medium
Re-evaluate and retrain the model every 3 months to adapt to evolving fraud patterns;Low;High;High
